publish_date,headline_category,headline_text
20010102,unknown,"Status quo will not be disturbed at Ayodhya; says Vajpayee"
20010102,unknown,"Fissures in Hurriyat over Pak visit"
20010102,unknown,"America's unwanted heading for India?"
20010102,unknown,"For bigwigs; it is destination Goa"
20010102,unknown,"Extra buses to clear tourist traffic"
20010102,unknown,"Dilute the power of transfers; says Riberio"
20010102,unknown,"Focus shifts to teaching of Hindi"
20010102,unknown,"IT will become compulsory in schools"
20010102,unknown,"Move to stop freedom fighters' pension flayed"
20010102,unknown,"Gilani claims he applied for passport 2 years ago"
20010102,unknown,"Parivar dismisses PM's warning"
20010102,unknown,"India; Pak exchange lists of N-plants"
20010102,unknown,"Will Qureshi's return really help the govt?"
20010102,unknown,"PM's tacit message: Put Ram tample on hold"
20010102,unknown,"Text of the Prime Minister's article"
20010102,unknown,"NCW to focus on violence against women"
20010102,unknown,"BBC's reality TV will focus on AIIMS"
20010102,unknown,"Jaitley firm on legal reforms"
20010102,unknown,"Hoshangabad farmers have enough water"
20010102,unknown,"BJP jumps into rail track conversion issue"
20010102,unknown,"America's unwanted heading for India?"
20010102,unknown,"State may take AP to court over Krishna"
20010102,unknown,"This official has sued the briber"
20010102,unknown,"Park turns temple compound as residents watch"
20010102,unknown,"Moves afoot to evict squatters in Urban dist"
20010102,unknown,"Mafia calls the shots in Gandhinagar too"
20010102,unknown,"Status quo will not be disturbed at Ayodhya; says Vajpayee"
20010102,unknown,"Fissures in Hurriyat over Pak visit"
20010102,unknown,"America's unwanted heading for India?"
20010102,unknown,"For bigwigs; it is destination Goa"
20010102,unknown,"Extra buses to clear tourist traffic"
20010102,unknown,"Dilute the power of transfers; says Riberio"
20010102,unknown,"Focus shifts to teaching of Hindi"
20010102,unknown,"IT will become compulsory in schools"
20010102,unknown,"Move to stop freedom fighters' pension flayed"
20010102,unknown,"Gilani claims he applied for passport 2 years ago"
20010102,unknown,"Parivar dismisses PM's warning"
20010102,unknown,"India; Pak exchange lists of N-plants"
20010102,unknown,"Will Qureshi's return really help the govt?"
20010102,unknown,"PM's tacit message: Put Ram tample on hold"
20010102,unknown,"Text of the Prime Minister's article"
20010102,unknown,"NCW to focus on violence against women"
20010102,unknown,"BBC's reality TV will focus on AIIMS"
20010102,unknown,"Jaitley firm on legal reforms"
20010102,unknown,"Hoshangabad farmers have enough water"
20010102,unknown,"BJP jumps into rail track conversion issue"
20010102,unknown,"America's unwanted heading for India?"
20010102,unknown,"State may take AP to court over Krishna"
20010102,unknown,"This official has sued the briber"
20010102,unknown,"Park turns temple compound as residents watch"
20010102,unknown,"Moves afoot to evict squatters in Urban dist"
20010102,unknown,"Mafia calls the shots in Gandhinagar too"
20010102,unknown,"Come to Nandi Hills...and you can fly"
20010102,unknown,"HAL approached for super jumbo project"
20010102,unknown,"Nagathihalli returns with Preethiya Hudugi"
20010102,unknown,"Fashion in the future"
20010102,unknown,"Promises to keep"
20010102,unknown,"Home is where the holistic science is"
20010102,unknown,"A noisy effort to spruce up Commercial Street"
20010102,unknown,"The best music of the year"
20010102,unknown,"Redemption night; amid some rock"
20010102,unknown,"Consul is back from month-long leave"
20010102,unknown,"Bomb hoax triggers panic in Canara Bank"
20010102,unknown,"Petition over ministers' assets dismissed"
20010102,unknown,"He beat polio; but a truck driver's is no life"
20010102,unknown,"Destroying myths and doubts on sexuality"
20010102,unknown,"Planning Dept seeks Rs 350 crore more"
20010102,unknown,"More engg colleges if needed in state: Govt"
20010102,unknown,"Auto driver's murder: 4 held"
20010102,unknown,"Meet held on cashew crop forecasting"
20010102,unknown,"Awareness rally on AIDS today"
20010102,unknown,"Record power generation at RTPS"
20010102,unknown,"Move to stop freedom fighters' pension flayed"
20010102,unknown,"Snags delay digital maps of city"
20010102,unknown,"Making education a people's movement"
20010102,unknown,"Murder spoils 2001 party in Dharwad"
20010102,unknown,"Now a website on a seer"
20010102,unknown,"Akki-Alur and Ranebennur peaceful"
20010102,unknown,"Weekly editor resorts to hunger strike"
20010102,unknown,"Bickering cost Dal(S) seats; admits Gowda"
20010102,unknown,"BJP to block traffic statewide on Jan 6"
20010102,unknown,"Dr Patwardhan to be felicitated"
20010102,unknown,"Lingambudhi will be turned into bird sanctuary"
20010102,unknown,"Cactus which made it to Guinness is dying"
20010102,unknown,"VIPs suffer as power supply is stopped to govt guest houses"
20010102,entertainment.hindi.bollywood,"Raju Chacha"
20010103,unknown,"Powerless north India gropes in the dark"
20010103,unknown,"Think again; Laxman tells Sangh Parivar"
20010103,unknown,"Hurriyat undecided over team to Pakistan"
20010103,unknown,"Vajpayee wants to put reforms on fast track"
20010103,unknown,"Stephen Hawking keeps date with Mumbai"
20010103,unknown,"Anti-Hrithik or anti-hopelessness"
20010103,unknown,"Govt plans stadium near Panaji"
20010103,unknown,"BJP doing a volte face on casinos: Cong"
20010103,unknown,"3 watershed projects on the anvil"
20010103,unknown,"No report yet on fire in Udyog Bhavan"
20010103,unknown,"He is the king of 'five star' industry"
20010103,unknown,"Petrol pump sealed for selling adulterated fuel"
20010103,unknown,"Milk price up by Rs 1 per litre"
20010103,unknown,"Congress House is no-smoking zone"
20010103,unknown,"Rural weightage: Govt reassures Governor"
20010103,unknown,"Bride gets honeymoon surprise: Chopper ride"
20010103,unknown,"Is hangover a sign of alcoholicism?"
20010103,unknown,"Almatti: AP to wait and watch"
20010103,unknown,"10-year-old girl missing"
20010103,unknown,"Hear his messages from the heart"
20010103,unknown,"Dance like no one's watching"
20010103,unknown,"From reel love to real love"
20010103,unknown,"Power row: Bribe attempt charge denied"
20010103,unknown,"Lakshamma's cry for help heard"
20010103,unknown,"It's shopping time for your newborn"
20010103,unknown,"Con games on the catwalk"
20010103,unknown,"They are here to help us"
20010103,unknown,"These noisy spots are hurting your ears"
20010103,unknown,"Flat tyres; flat music and a few famous faces"
20010103,unknown,"Yogananda birth anniversary fete on Dec 5"
20010103,unknown,"Tumkur gets 243 borewells"
20010103,unknown,"Over 2000 workers hit by lockout"
20010103,unknown,"Child project officer held for fraud"
20010103,unknown,"BCC holds talks on budget"
20010103,unknown,"Skybus metro trains on agenda"
20010103,unknown,"A disciple awaits a miracle from his Goddess"
20010103,unknown,"TOI scribe among Press Academy awardees"
20010103,unknown,"Talent Search exams on April 29"
20010103,unknown,"Ban orders extended in Ranebennur"
20010103,unknown,"Army turns to HAL for Lancer supply"
20010103,entertainment.hindi.bollywood,"'Devdas': Jinxed?"
20010104,unknown,"The string that pulled Stephen Hawking to India"
20010104,unknown,"Vajpayee gives big push to tech education; R&D"
20010104,unknown,"Norms for private role in banking tightened"
20010104,unknown,"A Maha Kumbh of media players"
20010104,unknown,"Net lottery: A winner or a sucker?"
20010104,unknown,"Us and the PM's Musings"
20010104,unknown,"Milosevic to be charged with 'abuse of office'"
20010104,unknown,"Tabu: Bar Bar Dekho"
20010104,unknown,"Anupam Kher: Sliver Spoon!"
20010104,unknown,"Aftab Shivdasani: Career Cares!"
20010104,unknown,"Court reserves judgment on custody of Ilyasi's daughter"
20010104,unknown,"A museum far from the madding crowds"
20010104,unknown,"Bangla Oppn leader issues 'fatwa' against judges"
20010104,unknown,"Hawking set to inspire science glitterati"
20010104,unknown,"Mission for technology education; more funds for R&D"
20010104,unknown,"Mental illness can pass from parent to child"
20010104,unknown,"Cholera outbreak source traced"
20010104,unknown,"Mathematics permeates human civilisation"
20010104,unknown,"Bangla Oppn leader issues 'fatwa' against judges"
20010104,unknown,"Bangladesh govt asks for Hamoodur Rahman report"
20010104,unknown,"Bangladesh 'scrutinising' citizen's death in US embassy"
20010104,unknown,"Claire Danes inks to star in 'It's About Love'"
20010104,unknown,"Hollywood posts record 9th year of box office gains"
20010104,unknown,"Akashdeep: Ghaath Ka Saath!"
20010104,unknown,"Great loss to Indian racing"
20010104,unknown,"The saga of Usha Stud Farm"
20010104,unknown,"Red Radior wins Victory Zone Cup"
20010104,unknown,"Race put off"
20010104,unknown,"Cyril sends Byron Black packing"
20010104,unknown,"Dent has the fastest serve in Chennai meet"
20010104,unknown,"Basu gives call to stop infighting"
20010104,unknown,"Violence mar Mamata's meeting in Midnapore"
20010104,unknown,"The string that pulled Stephen Hawking to India"
20010104,unknown,"Norms for private role in banking tightened"
20010104,unknown,"Net lottery: A winner or a sucker?"
20010104,unknown,"Us and the PM's Musings"
20010104,unknown,"Milosevic to be charged with 'abuse of office'"
20010104,unknown,"Tabu: Bar Bar Dekho"
20010104,unknown,"Anupam Kher: Sliver Spoon!"
20010104,unknown,"Court reserves judgment on custody of Ilyasi's daughter"
20010104,unknown,"A museum far from the madding crowds"
20010104,unknown,"Bangla Oppn leader issues 'fatwa' against judges"
20010104,unknown,"Court reserves judgment on custody of Ilyasi's daughter"
20010104,unknown,"String theory set to become one of hottest pieces of physics"
20010104,unknown,"Hawking set to inspire science glitterati"
20010104,unknown,"Mission for technology education; more funds for R&D"
20010104,unknown,"Mission for technology education; more funds for R&D"
20010104,unknown,"Mental illness can pass from parent to child"
20010104,unknown,"Cholera outbreak source traced"
20010104,unknown,"Mathematics permeates human civilisation"
20010104,unknown,"The string that pulled Stephen Hawking to India"
20010104,unknown,"Vajpayee gives big push to tech education; R&D"
20010104,unknown,"Norms for private role in banking tightened"
20010104,unknown,"A Maha Kumbh of media players"
20010104,unknown,"Net lottery: A winner or a sucker?"
20010104,unknown,"Us and the PM's Musings"
20010104,unknown,"Milosevic to be charged with 'abuse of office'"
20010104,unknown,"Tabu: Bar Bar Dekho"
20010104,unknown,"Anupam Kher: Sliver Spoon!"
20010104,unknown,"Aftab Shivdasani: Career Cares!"
20010104,unknown,"Court reserves judgment on custody of Ilyasi's daughter"
20010104,unknown,"A museum far from the madding crowds"
20010104,unknown,"Four more Iranians admit to role in serial murders"
20010104,unknown,"Bangla Oppn leader issues 'fatwa' against judges"
20010104,unknown,"String theory set to become one of hottest pieces of physics"
20010104,unknown,"Hawking set to inspire science glitterati"
20010104,unknown,"Mission for technology education; more funds for R&D"
20010104,unknown,"Mental illness can pass from parent to child"
20010104,unknown,"Cholera outbreak source traced"
20010104,unknown,"Mathematics permeates human civilisation"
20010104,unknown,"Bangla Oppn leader issues 'fatwa' against judges"
20010104,unknown,"Bangladesh govt asks for Hamoodur Rahman report"
20010104,unknown,"Bangladesh 'scrutinising' citizen's death in US embassy"
20010104,unknown,"Hollywood posts record 9th year of box office gains"
20010104,unknown,"Great loss to Indian racing"
20010104,unknown,"The saga of Usha Stud Farm"
20010104,unknown,"Red Radior wins Victory Zone Cup"
20010104,unknown,"Race put off"
20010104,unknown,"Basu gives call to stop infighting"
20010104,unknown,"Violence mar Mamata's meeting in Midnapore"
20010104,unknown,"CPT to have new pilot system by Jan 15"
20010104,unknown,"Film industry concerned about piracy"
20010104,unknown,"City drainage system being modernised"
20010104,unknown,"Keeping the Gandhian dream alive"
20010104,unknown,"An archaeologist par excellence"
20010104,unknown,"Education body overshoots self-imposed deadline"
20010104,unknown,"PIL urges to seek flood relief from UN"
20010104,unknown,"Sen urges country to exploit its tourism potential"
20010104,unknown,"CMC to issue notice to builder"
20010104,unknown,"World govt touted as solution to crises"
20010104,unknown,"ASI team digs up part of Fatehpur Sikri"
20010104,unknown,"Lara joins elite club"
20010104,unknown,"Cullinan hits fourth Newlands hundred"
20010104,unknown,"Cronje case behind low cricket match attendance"
20010104,unknown,"Indian refusal cost PCB 2.4 cr"
20010104,unknown,"Das ready to face the short-pitch stuff"
20010104,unknown,"Haldipur; Lahiri in good stand"
20010104,unknown,"DU North Zone inter-varsity cricket champions"
20010104,unknown,"Kolkata gears up for Millennium Cup"
20010104,unknown,"Right choice is the key; says Iranian coach"
20010104,unknown,"Rajasthan lose lead and match"
20010104,unknown,"Hockey hopes rest on flowerin talent"
20010104,unknown,"Anand may get Padmabhushan"
20010104,unknown,"Emotion-choked Chennai showers love on Anand"
20010104,unknown,"Close battle for Mahindra Golfer; 2001"
20010104,unknown,"Indian Blues off to a good start"
20010104,unknown,"Ramgarh beat Royal Kashmir in Hanut Cup polo"
20010104,unknown,"Anand may get Padmabhushan"
20010104,unknown,"Cullinan hits fourth Newlands hundred"
20010104,unknown,"Ex-mayor takes up cudgels against Kothrud garbage depot"
20010104,unknown,"India is no IT superpower"
20010104,unknown,"A clean sweep"
20010104,unknown,"The Sphinx can act too"
20010104,unknown,"Giving audio-video education a cutting edge"
20010104,unknown,"Govt orders study of river diversion"
20010104,unknown,"Govt bears burden as VIPs throng Goa"
20010104,unknown,"Goa told to start quick-growth coconut project"
20010104,unknown,"Experts discuss horticulture development"
20010104,unknown,"5 acquitted in trespassing case"
20010104,unknown,"Development of horticulture stressed"
20010104,unknown,"New office-bearers for ICSI"
20010104,unknown,"CM to review security for Premji; Murthy"
20010104,unknown,"Govt allots UKP project to KPC"
20010104,unknown,"Star hotels in city get tech-savvy"
20010104,unknown,"When principals wed"
20010104,unknown,"Misbehaving conductors face action"
20010104,unknown,"Pubs are on the watch for violence"
20010104,unknown,"Celestial show awaits aircraft lovers"
20010104,unknown,"Kannada organisations oppose felicitating Nedumaran"
20010104,unknown,"Civic polls: Minister refutes BJP charges"
20010104,unknown,"Oh; for that black & white magic!"
20010104,unknown,"No clue about kidnapped boy"
20010104,unknown,"New year hash: They paid Rs 18;000; went hungry"
20010104,unknown,"5;000 anganwadis to get buildings"
20010104,unknown,"Cops shoot at sandalwood smugglers; nab one"
20010104,unknown,"Tribute-paying ritual for Patel today"
20010104,unknown,"A life snuffed out needlessly"
20010104,unknown,"PM arriving on a 2-day visit"
20010104,unknown,"Make mysterious kidnap drama secret public"
20010104,unknown,"Pollution makes these residents see red"
20010104,unknown,"Behind the walls; it's celebration time"
20010104,unknown,"Corporate cricket has lot of scope"
20010104,unknown,"An art gallery for the underprivileged"
20010104,unknown,"Annual Infant Jesus feast from Jan 14"
20010104,unknown,"Ex-Karnataka HC judge visits Bahrain"
20010104,india,"Dudhwa tiger died of starvation; not poisoning"
20010104,city.bengaluru,"Three in race for chief secy's post"
20010104,city.patna,"Druggists' stir leads to shortage of medicines"
20010104,business.india-business,"Car dealers caught in Bihar sales tax ruling"
20010104,entertainment.english.hollywood,"Space Cowboys"
20010104,city.bengaluru,"He's not so inscrutable"
20010104,city.delhi,"DPCC stages Nyay rally"
20010104,entertainment.english.hollywood,"Unbreakable"
20010105,unknown,"Light combat craft takes India into club class"
20010105,unknown,"Hawkings' day out"
20010105,unknown,"Light combat craft takes India into club class"
20010105,unknown,"Easy drugs at raves keep Goa hot on tourist circuit"
20010315,unknown,"Tehelka expose a boon for Laloo"
20010315,unknown,"Tehelka zindabad; but what is dot com"
20010315,unknown,"Laloo on the offensive; again"
20010316,unknown,"Tape and Tell"
20010317,entertainment.english.hollywood,"Crouching Tiger; Hidden Dragon"
20010425,unknown,"Clear stand on Pakistan or else: BCCI to govt"
20010425,unknown,"Born again: Antony discovers new economy"
20010425,unknown,"Hindus at snooty end of class divide"
20010425,unknown,"India opts for Frankenfoods; while world desists"
20010425,unknown,"Unwed parents romantically involved than expected"
20010425,unknown,"Abhishek Bachchan: Mama's pet!"
20010425,unknown,"Akshay & Twinkle: Jodi No.1"
20010425,unknown,"Yeh Tera Ghar Yeh Mera Ghar: Aur Ek Ghar!"
20010425,unknown,"Kim Sharma: From the Frying 'Paan'!"
20010425,unknown,"Abhishek Bachchan: Mama's pet!"
20010425,unknown,"Yeh Tera Ghar Yeh Mera Ghar: Aur Ek Ghar!"
20010425,unknown,"Governor urges people to save heritage sites"
20010425,unknown,"A children's home that adheres to rules"
20010425,unknown,"Govt draws flak over rice procurement"
20010425,unknown,"Signal Service"
20010425,unknown,"Pulling the Plug"
20010425,unknown,"Yen for Dogdom"
20010425,unknown,"Without My Daughter"
20010425,unknown,"Nataraja's Dance: Science & Intuition"
20010425,unknown,"Winning Suit"
20010425,unknown,"Boom Time for Biotech"
20010425,unknown,"Straight Answers"
20010425,unknown,"HC vindicates govt in power rebate case"
20010425,unknown,"Mangoes become delight of the elite"
20010425,unknown,"Cong hails court decision"
20010425,unknown,"Study suggests delimitation of sanctuaries"
20010425,unknown,"Count of people below poverty line not a priority"
20010425,unknown,"Teachers post yet to be filled up"
20010425,unknown,"HLL net up; board approves merger"
20010425,unknown,"All players resist IFCI; IDBI merger"
20010425,unknown,"Car sales dip 11% in March"
20010425,unknown,"Will Prasar Bharati listen to HFCL-Nine"
20010425,unknown,"Rs 1;600 cr WB aid for roads in Karnataka"
20010425,unknown,"Gandhi's homespun fabric goes in for a makeover"
20010425,unknown,"Gloom forecaster Carly promises India growth;jobs"
20010425,unknown,"Fanning the consumer revolution"
20010425,unknown,"Gloom forecaster Carly promises India growth;jobs"
20010425,unknown,"India has no reasons to worry: Chugh"
20010426,unknown,"I-T department files hawala report; names Advani; Sinha"
20010426,unknown,"Sinha offers new deal to tax payers"
20010426,unknown,"Uma hits out at cricket board"
20010426,unknown,"Wipro's Premji bullish despite slowdown"
20010426,unknown,"Jaya makes an emotional pitch to voters"
20010426,unknown,"Bangladesh Blunder"
20010426,unknown,"Smoke Screen"
20010426,unknown,"Funny Films"
20010426,unknown,"Tamil Politics"
20010426,unknown,"Happiness is Peace Between Neighbours"
20010426,unknown,"Radio-activity"
20010426,unknown,"War and Peace"
20010426,unknown,"All-England's Not Enough"
20010426,unknown,"Straight Answers"
20010426,unknown,"Get proactive on paddy issue says CM"
20010426,unknown,"Warangal bandh evokes lukewarm response"
20010426,unknown,"Simhachalam temple spruced up for Chandanotsavam"
20010426,unknown,"BJP to stage rallies against VMC misdeeds"
20010426,unknown,"AP; Karnataka police to work in tandem"
20010426,unknown,"Police repulse naxal attack"
20010426,unknown,"Tiger census begins"
20010426,unknown,"First batch of astrology grads set to hit the market"
20010426,unknown,"Azim Premji: The brain behind Wipro's winning streak"
20010426,unknown,"Vijayawada mayor should step down: CPM"
20010426,unknown,"INS Darshak to be commissioned on Sunday"
20010426,unknown,"Court order on GCA president tomorrow"
20010426,unknown,"Ticketgate: Govt told to set up probe panel"
20010426,unknown,"Swiss envoy to call on CM today"
20010426,unknown,"Dance festival from tomorrow"
20010426,unknown,"Taiwanese President meets Ang Lee"
20010426,unknown,"Adnan Sami: Welcome to tinsel town!"
20010426,unknown,"Govinda: Kin(d) gestures!"
20010426,unknown,"Jimmy Shergill: Marriage bliss!"
20010426,unknown,"Ashutosh Rana: A peace of his mind!"
20010426,unknown,"Beauty queen is now building brands"
20010426,unknown,"Adnan Sami: Welcome to tinsel town!"
20010426,unknown,"Govinda: Kin(d) gestures!"
20010426,unknown,"Jimmy Shergill: Marriage bliss!"
20010426,unknown,"Nehru Cup hockey"
20010426,unknown,"Sachin spends birthday in Bali"
20010426,unknown,"Tamil Politics"
20010426,unknown,"All-England's Not Enough"
20010427,unknown,"Hurriyat puts a price on peace: No Pak; no talks"
20010427,unknown,"Enron ready to pull out; but lenders say wait"
20010427,unknown,"54 children rescued in Andhra adoption racket bust"
20010427,unknown,"Bangladesh blames BSF; seeks end to border row"
20010427,unknown,"Shyamalan shows more 'Signs' of success"
20010427,unknown,"Success in the times of a tech meltdown"
20010427,unknown,"Shyamalan shows more 'Signs' of success"
20010427,unknown,"Not Apna Budget"
20010427,unknown,"Grains of Wrath"
20010427,unknown,"Certified Purohits"
20010427,unknown,"Tehri Infirma"
20010427,unknown,"Shankara: Scholar; Teacher & Redeemer"
20010427,unknown,"The Bushman"
20010427,unknown,"Money & Governance"
20010427,unknown,"Age No Bar"
20010427,unknown,"Straight Answers"
20010427,unknown,"Shyamalan shows more 'Signs' of success"
20010427,unknown,"Sunil Shetty: Bagfull of films!"
20010427,unknown,"Sanjay Gupta: Hollywood freak!"
20010427,unknown,"Jackie Schroff: Hooked to net!"
20010427,unknown,"Tinsel Ville: Beat the heat!"
20010427,unknown,"Cong urges Sonia to take up Telangana issue"
20010427,unknown,"Deputy speaker not to quit TDP"
20010427,unknown,"State govt seeks details of Central funding to NGOs"
20010427,unknown,"Adoption authority team visits agencies in city"
20010427,unknown,"80 IAS; IFS officers to supervise Janmabhoomi programme implementation"
20010427,unknown,"Another weaver commits suicide"
20010427,unknown,"61 kids from Precious Moments shifted to Shishu Vihar"
20010427,unknown,"Left parties to stage rasta roko on April 28"
20010427,unknown,"CM pulls up S Aruna"
20010427,unknown,"Consultant says corrupt judges have no immunity"
20010427,unknown,"NGOs warned against misusing Christian names"
20010427,unknown,"Blacklist contractors failing to complete work on time: CM"
20010427,unknown,"Bharat Thakur to conduct workshop on meditation"
20010427,unknown,"Artillery Centre accords warm welcome to Lt Gen Sampat Kumar"
20010427,entertainment.hindi.bollywood,"Pyaar Tune Kya Kiya"
20010428,unknown,"Morality not one-sided: PM tells Cong"
20010428,unknown,"Sonia Gandhi ko gussa kyon aata hai?"
20010428,unknown,"Singh out of PMO; reshuffle on the cards"
20010428,unknown,"Now; Indian teachers may dominate the H1B crowd"
20010428,unknown,"Rogue General theory has few takers in Bangladesh"
20010428,unknown,"A temblor from ancient Indian treasure trove?"
20010428,unknown,"Rani Mukherjee: Sorry Mani; it's not about money"
20010428,unknown,"Aditya Rai: With just a little help from my sis"
20010428,unknown,"Ramgopal Verma: Third time lucky?"
20010428,unknown,"Mahesh Manjrekar: The man behind the gimmicks"
20010428,unknown,"Mine is an honorary post: Amala"
20010428,unknown,"Cong has become a laughing stock: Venkaiah"
20010428,unknown,"Now; BCC suffers from withdrawal symptoms"
20010428,unknown,"Many strings to his music"
20010428,unknown,"Vehicle thefts on the rise in B'lore"
20010428,unknown,"Film corporation in bad shape"
20010428,unknown,"Dial V; get connected to remote villages"
20010428,unknown,"Rock around the clock"
20010428,unknown,"Silly little stumbling blocks"
20010428,unknown,"Marriage still a battle for epilepsy patients"
20010428,unknown,"B'lore firms keen on ethics code for employees"
20010428,unknown,"Pavement here today; gone tomorrow"
20010428,unknown,"BCC panel to get fresh lease of life"
20010428,unknown,"B'lore varsity fails to stick to exam manual"
20010428,unknown,"Krishna to campaign in Kerala"
20010428,unknown,"Bangalore Customs exceeds revenue target"
20010428,unknown,"Garbage disposals during night and evening: BCC"
20010428,unknown,"Whitefield residents walk on tightrope!"
20010428,unknown,"Police can video-conference now"
20010428,unknown,"Constable posed as PRO to lure jobless youth"
20010428,unknown,"Ex-deputy mayor of Mysore in limelight"
20010428,unknown,"Engineer caught taking bribe"
20010428,unknown,"Political parties make a beeline for voters"
20010428,unknown,"Frenzied activity in political circles"
20010429,unknown,"I-T department's googly traps BCCI"
20010429,unknown,"Memories of the Mahatma a burden for us?"
20010429,unknown,"The road not taken"
20010429,unknown,"CBI chief to retire; but where is his successor?"
20010429,unknown,"Cellular doyens plead their case with PM"
20010429,unknown,"There's a serial killer on the Net"
20010429,unknown,"'Chamma Chamma' charms Nicole Kidman"
20010429,unknown,"We; the people or woe; the people?"
20010429,unknown,"Govinda: the king of mass entertainment"
20010429,unknown,"Biwi No. 1"
20010429,unknown,"Cyber Babu"
20010429,unknown,"Has Bhatt become a bore"
20010429,unknown,"Arjun and the Goda"
20010429,unknown,"'I'm in the mood for vengeance'"
20010429,unknown,"A big leap"
20010429,unknown,"Weaving fantasies"
20010429,unknown,"I have stories to tell"
20010429,unknown,"On auto pilot"
20010429,unknown,"Portrait of an artist"
20010429,unknown,"Architects must be like teachers"
20010429,unknown,"Young composers hesitate to correct me"
20010429,unknown,"From Sanjay to Sonia"
20010429,unknown,"Rebel without a pause"
20010429,unknown,"Give Brokers A Break"
20010429,unknown,"Straight Answers"
20010429,unknown,"The Bandh Wagon"
