publish_date,headline_category,headline_text
20010513,swaminomics,"Recessions have become tamer"
20010514,unknown,"Buddha smiles; Amma bounces back"
20010514,unknown,"No pattern; only many new questions"
20010514,unknown,"India to seek Malaysia's help for entry into ASEAN"
20010514,unknown,"The man who invented Malgudi"
20010514,unknown,"The Disappearing Sex"
20010514,unknown,"Mama Mia"
20010514,unknown,"Polls Apart"
20010514,unknown,"Star of Superstition"
20010514,unknown,"The Supreme One & His Many Forms"
20010514,unknown,"My Black Beauty"
20010514,unknown,"Individual Freedom"
20010514,unknown,"Friends and Foes"
20010514,unknown,"Straight Answers"
20010514,unknown,"Karnataka reassures Goa on river issue"
20010514,unknown,"Minor raped; accused absconding"
20010514,unknown,"CM inspects oil spillage"
20010514,unknown,"New bus service introduced"
20010514,unknown,"Whither online advertising?"
20010514,unknown,"Microsoft's new strategy: Upgrade or else..."
20010514,unknown,"Bharti calling; money talks"
20010514,unknown,"Chandigarh is all set to join the IT bandwagon"
20010514,unknown,"Information warfare: Is India Prepared for it?"
20010514,unknown,"CM apologises for delay in cable work"
20010514,unknown,"KPTC up in arms over changes in project plans"
20010514,unknown,"Abroad ahoy..that's the consensus"
20010514,unknown,"Will the angels smile on their tiny bundle of joy?"
20010514,unknown,"Let's crawl beneath the flyover till Dalwai gets CM to inaugurate it"
20010514,unknown,"Library turns tailoring centre; is BCC listening?"
20010514,unknown,"Row over snub to MP at counting centre"
20010514,unknown,"All set for CET on May 16; 17"
20010514,unknown,"Madam will nab Veerappan: AIADMK"
20010514,unknown,"Not loud; but good adspeak"
20010514,unknown,"Documentary on Kodavas bags national award"
20010514,unknown,"Kodagu tourney: Referee manhandled"
20010514,unknown,"Woman murdered by son; daughter-in-law"
20010514,unknown,"Popularise coffee consumption: Minister"
20010514,unknown,"Hybrid cotton to be grown this season"
20010514,unknown,"KSOU introduces new IT courses"
20010514,unknown,"Lifetime Achievement award for Rajkumar"
20010514,unknown,"Rs 10 cr for desilting of Kolar tanks"
20010514,unknown,"Rs 9.25 lakh hawala money seized"
20010514,unknown,"DK ZP adjudged best in state"
