publish_date,headline_category,headline_text
20010429,unknown,"Misarranged marriage"
20010429,unknown,"Advantage BCCI"
20010429,unknown,"India's Missing Women"
20010429,unknown,"Sankara & Ramanuja: Meaning and Being"
20010429,unknown,"Harappan Lore"
20010429,unknown,"Sri Sankara Jayanti"
20010429,unknown,"A 'Close-Up' of Hrithik Roshan"
20010429,unknown,"Raveena Tandon: On 'knotty' duties!"
20010429,unknown,"Puru Rajkumar: The word is 'mum'!"
20010429,unknown,"Amar Upadhyay: Exploring cyberspace!"
20010429,unknown,"Producer willing to accept 'Sadhane' award"
20010429,only-in-america,"The Road Not Taken"
20010501,unknown,"India unhappy with US leaving out Lashkar from list"
20010501,unknown,"V P Singh's to blame; Joshi tells Ayodhya panel"
20010501,unknown,"Trinamul wanted armed help to combat CPM; says PWG"
20010501,unknown,"No yarns; only stories of misery for Andhra weavers"
20010501,unknown,"Cong prowling around to buy BJP MLAs"
20010501,unknown,"Court notices CM; minister over contempt"
20010501,unknown,"MGP president resigns"
20010501,unknown,"It's manual work despite computerisation"
20010501,unknown,"Housewife murdered in Margao"
20010501,unknown,"Insurance Act: Company head must be included"
20010501,unknown,"Margoa councillors to get Rs 2 lakh each for development"
20010501,unknown,"Still Backwaters"
20010501,unknown,"Cyborg Genesis"
20010501,unknown,"Succulent Summer"
20010501,unknown,"The Forgotten Scam"
20010501,unknown,"Guru Darshan: A Teaching Event"
20010501,unknown,"Match Industry"
20010501,unknown,"Know More"
20010501,unknown,"Fare Thee Well"
20010501,unknown,"Straight Answers"
20010501,unknown,"One role; many dimensions"
20010501,unknown,"Anil Kapoor: Making 'bakras'!"
20010501,unknown,"Tara bags best actress award"
20010501,unknown,"Govinda-Sanjay Dutt: Easy money!"
20010501,unknown,"Akshay Kumar: Signing Amitabh saves time and money!"
20010501,unknown,"An induced heart attack saved his life"
20010501,unknown,"Students pay the price for college's mistake"
20010501,unknown,"Govt willing for CBI probe into adoption home case"
20010501,unknown,"His passion for golf will stump you"
20010501,unknown,"At 70; Krishna still feels young"
20010501,unknown,"Roadathon: Tracking the truck's progress"
20010501,unknown,"7 Bangloreans killed in TN accident"
20010501,unknown,"Here's a school built on a vision"
20010501,unknown,"One role; many dimensions"
20010501,unknown,"A dogged fight"
20010501,unknown,"No stereotyping for these multi-skilled women"
20010501,unknown,"Will the 'dead water' of Ulsoor Lake ever spring to life?"
20010501,unknown,"An induced heart attack saved his life"
20010501,unknown,"Tara bags best actress award"
20010501,unknown,"US consulate introduces new visa scheme"
20010501,unknown,"Sai Baba hospital: A refuge to millions"
20010502,unknown,"India unhappy with US leaving out Lashkar from list"
20010502,unknown,"V P Singh's to blame; Joshi tells Ayodhya panel"
20010502,unknown,"Trinamul wanted armed help to combat CPM; says PWG"
20010502,unknown,"No yarns; only stories of misery for Andhra weavers"
20010502,unknown,"Cong prowling around to buy BJP MLAs"
20010502,unknown,"Court notices CM; minister over contempt"
20010502,unknown,"MGP president resigns"
20010502,unknown,"It's manual work despite computerisation"
20010502,unknown,"Housewife murdered in Margao"
20010502,unknown,"Insurance Act: Company head must be included"
20010502,unknown,"Margoa councillors to get Rs 2 lakh each for development"
20010502,unknown,"'West Wing' creator charged"
20010502,unknown,"Still Backwaters"
20010502,unknown,"Cyborg Genesis"
20010502,unknown,"Succulent Summer"
20010502,unknown,"The Forgotten Scam"
20010502,unknown,"Guru Darshan: A Teaching Event"
20010502,unknown,"Match Industry"
20010502,unknown,"Know More"
20010502,unknown,"Fare Thee Well"
20010502,unknown,"Straight Answers"
20010502,unknown,"One role; many dimensions"
20010502,unknown,"Anil Kapoor: Making 'bakras'!"
20010502,unknown,"Tara bags best actress award"
20010502,unknown,"Govinda-Sanjay Dutt: Easy money!"
20010502,unknown,"Akshay Kumar: Signing Amitabh saves time and money!"
20010502,unknown,"Vashu Bhagnani: No music please!"
20010502,unknown,"An induced heart attack saved his life"
20010502,unknown,"Students pay the price for college's mistake"
20010502,unknown,"Govt willing for CBI probe into adoption home case"
20010502,unknown,"His passion for golf will stump you"
20010502,unknown,"At 70; Krishna still feels young"
20010502,unknown,"Roadathon: Tracking the truck's progress"
20010502,unknown,"7 Bangloreans killed in TN accident"
20010502,unknown,"Here's a school built on a vision"
20010502,unknown,"One role; many dimensions"
20010502,unknown,"Priya Rajan Bala"
20010502,unknown,"No stereotyping for these multi-skilled women"
20010502,unknown,"Debts claim another farmer's life"
20010502,unknown,"Will the 'dead water' of Ulsoor Lake ever spring to life?"
20010502,unknown,"An induced heart attack saved his life"
20010502,unknown,"Tara bags best actress award"
20010502,unknown,"US consulate introduces new visa scheme"
20010503,unknown,"Bush sending envoy to argue NMD case"
20010503,unknown,"Bush sending envoy to argue NMD case"
20010503,unknown,"Bush takes one more woman on South Asia team"
20010503,unknown,"Vajpayee sups with Advani; seeks truce"
20010503,unknown,"Most BALCO unions agree to resume work"
20010503,unknown,"Bush sending envoy to argue NMD case"
20010503,unknown,"Bush takes one more woman on South Asia team"
20010503,unknown,"Vajpayee sups with Advani; seeks truce"
20010503,unknown,"Most BALCO unions agree to resume work"
20010503,unknown,"Free flies the Tricolour; at last"
20010503,unknown,"Streets to get Smart with New Beetles"
20010503,unknown,"'Ji Mantriji' is serious business for BBC"
20010503,unknown,"Bryan hopes to feel Bangalore summer"
20010503,unknown,"Amitabh Bachchan: Star Plus success!"
20010503,unknown,"Bikram Saluja: Blow the candle; make a wish!"
20010503,unknown,"Heavens; it's not Science"
20010503,unknown,"Straight Answers"
20010503,unknown,"'Ji Mantriji' is serious business for BBC"
20010503,unknown,"Amitabh Bachchan: Star Plus success!"
20010503,unknown,"Bryan hopes to feel Bangalore summer"
20010503,unknown,"Bikram Saluja: Blow the candle; make a wish!"
20010503,unknown,"Kareena Kapoor: Dreaded discipline!"
20010503,unknown,"Rani Mukherjee: O my darling; O my darling!"
20010503,unknown,"Learning to Grow"
20010503,unknown,"Tito's Trek"
20010503,unknown,"Cook's Tikka"
20010503,unknown,"Let Enron Exit"
20010503,unknown,"Children's Day"
20010503,unknown,"Staying Cool"
20010503,unknown,"Global campaign to improve the lot of children"
20010503,unknown,"Rites of Passage"
20010503,unknown,"Stewards crack down on erring jockeys"
20010503,unknown,"Parents must change their attitude: Psychiatrist"
20010503,unknown,"Let Enron Exit"
20010504,unknown,"BDR offers a tortuous defence"
20010504,unknown,"India giving up its global nanny role; say experts"
20010504,unknown,"Govinda gets 'court ka jhatka' over Mirinda ad"
20010504,unknown,"US Hindus take on McDonald's over French fries"
20010504,unknown,"Bush Fire"
20010504,unknown,"Ranjan's Revenge"
20010504,unknown,"Alliterative Politics"
20010504,unknown,"Two to Tango"
20010504,unknown,"Speaking of Shiva Soul and Salvation"
20010504,unknown,"Banarasi Babu"
20010504,unknown,"I and Mine"
20010504,unknown,"Leading from the Front"
20010504,unknown,"Straight Answers"
20010504,unknown,"Paagalpan: Youthful; romantic; and fresh!"
20010504,unknown,"Raveena Tandon has a blast!"
20010504,unknown,"No more 'sapnays' for Rajiv Menon"
20010504,unknown,"Film City Studios renamed!"
20010504,unknown,"Dance is a full-fledged profession for them"
20010504,unknown,"Pasta-pizza habit the perfect sure-starter for Squillari"
20010504,unknown,"Chand Khanna are the champions"
20010504,unknown,"Shabbir Ali to take charge of Bhratri"
20010504,unknown,"Chinese Taipei; India share day one honours"
20010504,unknown,"Drought takes Govt by surprise. Again."
20010504,unknown,"Home ministry set for major reshuffle"
20010504,unknown,"How two babudoms ruined the fate of lakhs of depositors"
20010504,unknown,"Its never say die for N K Singh?"
20010504,unknown,"When govt moved at speed of thought"
20010504,unknown,"Railways inefficient landlord; says panel"
20010504,unknown,"Discover India by Rail"
20010504,unknown,"House panel peeved with Maneka's ministry"
20010504,unknown,"Posts goes e-wire with money orders"
20010504,unknown,"Conventional sweep at non-conventional way"
20010505,unknown,"May Day Globaloney"
20010505,unknown,"Proceedings dropped against 21 in Ayodhya case"
20010505,unknown,"US dangles military cooperation carrot to India"
20010505,unknown,"US voted off UN human rights panel; Pakistan in"
20010505,unknown,"If stars are right; Amma shall smile"
20010505,unknown,"May Day Globaloney"
20010505,unknown,"Wasteminister Model"
20010505,unknown,"Formula Film"
20010505,unknown,"Ethics of Expose"
20010505,unknown,"Know & Integrate Your Many Faces"
20010505,unknown,"Brunner's Canvas"
20010505,unknown,"Clear and Present"
20010505,unknown,"Kremlin Calling"
20010505,unknown,"Straight Answers"
20010505,unknown,"No phone; yet a hefty bill!"
20010505,unknown,"Cricketgate: Hearing posted to May 8"
20010505,unknown,"Drive on to streamline traffic in Margao"
20010505,unknown,"Regional parties will thrive"
20010505,unknown,"Two more thefts in state"
20010505,unknown,"New kerosene prices"
20010505,unknown,"Deendar leaders knew of subversive activities"
20010505,unknown,"Helpline started at Sishu Vihar for anxious parents"
20010505,unknown,"Cops dread doctors in morgues"
20010505,unknown,"Distress sale of mangoes in Vijayawada market"
20010505,unknown,"Lax officials deny girl reunion with family"
20010505,unknown,"Govt to hand over Rs 15-cr to Gujarat quake victims"
20010505,unknown,"DYFI happy over hospital shifting"
20010505,unknown,"CPM chides TRS chief"
20010505,unknown,"JAC hails CM's gesture"
20010505,unknown,"Caribbean shores beckon medical students"
20010505,unknown,"Octroi withdrawal may hit local bodies"
20010505,unknown,"IAF holds Commanders' Conference"
20010505,unknown,"PIL against govt on Madhavpura bank issue"
20010505,unknown,"90;000 MSU marksheets had a spelling mistake!"
20010505,unknown,"Another sandalwood tree felled on MSU campus"
20010505,unknown,"Another case of CAS violation on MSU campus"
20010505,unknown,"Petrol becomes cheaper; diesel dearer"
20010505,unknown,"Probe ordered into death of sparrows"
20010505,unknown,"VMC told to clean up Sindhusagar lake"
20010505,unknown,"Study trips for women corporators draws flak"
20010505,unknown,"Need for public toilets stressed"
20010505,unknown,"Former Nadiad municipal councillor dead"
20010505,unknown,"Ethics of Expose"
20010506,unknown,"Why India shouldn't have bought the NMD"
20010506,unknown,"Sex; drugs; rock 'n' roll and NMD"
20010506,unknown,"Cowboy capers of the Dubya kind"
20010506,unknown,"Indian beauty behind Christie's-Sotheby's divorce"
20010506,unknown,"Desi netizens go bananas over alphonsos"
20010506,unknown,"A tale of two auction houses"
20010506,unknown,"You can find a sea of fish here"
20010506,unknown,"Power scam: Ex-minister grilled"
20010506,unknown,"Paulo Travels to run Hyderabad bus"
20010506,unknown,"Bribery case: Bail for Khemlo rejected"
20010506,unknown,"Usage of Portugese in post-offices opposed"
20010506,unknown,"Kremlin Calling"
20010506,unknown,"Straight Answers"
20010506,unknown,"Search still on for wicketkeeper: Ganguly"
20010506,unknown,"Muralitharan spins Lancashire to victory"
20010506,unknown,"Indian Airlines cricket cup"
20010506,unknown,"Injured Dhanraj to miss World Cup qualifiers"
20010506,unknown,"Search still on for wicketkeeper: Ganguly"
20010506,unknown,"Dokic to play Venus after defeating Sanchez-Vicario"
20010506,only-in-america,"Sex; drugs; rock 'n' roll and NMD"
20010507,unknown,"Fardeen Khan remanded to NCB custody till May 18"
20010507,unknown,"ISI plot to kill Tehelka chief; editor foiled"
20010507,unknown,"These wars are fought in air-conditioned rooms"
20010507,unknown,"MGR is god; say villagers"
20010507,unknown,"Karunanidhi still has to fight MGR here"
20010507,unknown,"Manisha Koirala: Stripping for a cause?"
20010507,unknown,"Aamir wants to play chess with Vishwanathan Anand"
20010507,unknown,"Songs and more songs from Sunita Rao"
20010507,unknown,"Eighteen Till I Die"
20010507,unknown,"Songs and more songs from Sunita Rao"
20010507,unknown,"Sonam: A glowing silence!"
20010507,unknown,"Political storm brewing in state"
20010507,unknown,"Mango prices come down"
20010507,unknown,"Firm told to settle demands of staff"
20010507,unknown,"Car driver responsible for accident: CM"
20010507,unknown,"Man held for killing sister"
20010507,unknown,"Business as usual at Anjuman - minus Deendar"
20010507,unknown,"More drama at Sishu Vihar"
20010507,unknown,"Minister urges YSR not to provoke farmers"
20010507,unknown,"Govt to announce welfare package for Telangana"
20010507,unknown,"Poor response to rainwater harvesting"
20010507,unknown,"MIM blames HUDA for 'encroaching' wakf land"
20010507,unknown,"HUDA to work on expressway from August"
20010507,unknown,"Power lines to be replaced in profitable areas"
20010507,unknown,"The Cutting Edge"
20010507,unknown,"Boost for BJP"
20010507,unknown,"Grounding the UFOs"
20010507,unknown,"Cold War Comeback"
20010507,unknown,"The Buddha as an Avatar of Vishnu"
20010507,unknown,"Hear; Hear"
20010507,unknown,"So Ignorant"
20010507,unknown,"Bangladeshi Jamaat"
20010507,unknown,"Straight Answers"
20010507,unknown,"Flourspar project faces permanent closure"
20010507,unknown,"Court rules in favour of MSU"
20010507,unknown,"MSU professor honoured for work in geology"
20010507,unknown,"Lack of operational discipline worries WREB"
20010507,unknown,"Might is right on these roads"
20010507,unknown,"Lack of irrigation taking toll on crops"
20010507,unknown,"Welcome change in Barodians' attitude to trees"
20010507,unknown,"How many people know of Ramesh Parikh's past?"
20010507,unknown,"Left Front leaders start smiling again"
20010507,unknown,"Turnout to decide Tamil Nadu tossup"
20010508,unknown,"Plot to kill Tejpal part of larger conspiracy: PM"
20010508,unknown,"Did govt want Hindujas to represent it?"
20010508,unknown,"Games leaders play: Why PM said YES to Uma's NO"
20010508,unknown,"Daler's album insults Islam; say Muslim groups"
20010508,unknown,"India can aim for the moon now"
20010508,unknown,"Straight Answers"
20010508,unknown,"Smart cards for govt employees soon"
20010508,unknown,"Fissures enter service industry"
20010508,unknown,"GCA seeks 45 days to submit audits"
20010508,unknown,"Goans wake up to ill-treatment of animals"
20010508,unknown,"'Red alert' on potholes"
20010508,unknown,"CM submits breach of privilege notice to citizen"
20010508,unknown,"Another robbery case in Margao; Rs 4.27 lakh looted"
20010508,unknown,"Work at Sesa plant begins today"
20010508,unknown,"Panel to hold convention on May 28; 29"
20010508,unknown,"Doubts about Didi"
20010508,unknown,"The Mouse Map"
20010508,unknown,"Laloo's Pitch"
20010508,unknown,"Big on Symbolism"
20010508,unknown,"Jainology Prefigured Postmodern Thought"
20010508,unknown,"General Exceptions"
20010508,unknown,"A Life of My Own"
20010508,unknown,"Logo Brouhaha"
20010508,unknown,"CM's deadline up; but cable mess remains"
20010508,unknown,"Adoption racket: State open to CBI probe"
20010508,unknown,"Raj kidnap: Unkept promises irk Tamils"
20010508,unknown,"Beauty and the tooth"
20010508,unknown,"Polls not a referendum on NDA govt: Advani"
20010508,unknown,"Bellary fiasco shocks Sonia"
20010508,unknown,"It's time for cladestine ties and trading"
20010508,unknown,"These eateries make you lose your appetite"
20010508,unknown,"Under pressure to excel"
20010508,unknown,"Admissions on the basis of merit"
20010508,unknown,"75-year-old woman done to death in B'lore"
20010508,unknown,"Got to mind your phone manners"
20010508,unknown,"BJP postmortem today"
20010508,unknown,"Night power for farmers begins on trial basis"
20010508,unknown,"Reservation norms for civic body heads soon"
20010509,unknown,"Fresh arrest warrants against Laloo; Mishra"
20010509,unknown,"Free as a fugitive in lawless Bihar"
20010509,unknown,"Hindujas were used in national interest"
20010509,unknown,"India should bargain for support to NMD"
20010509,unknown,"Helicopter goes missing in Arunachal"
20010509,unknown,"No work permit for Bangladeshis: Sushma"
20010509,unknown,"Bryan Adams offers mangoes to soothsayer"
20010509,unknown,"Brand Power"
20010509,unknown,"Pervez Playback"
20010509,unknown,"A Suitable Gene"
20010509,unknown,"Uddhava Gita : A Spiritual Beacon"
20010509,unknown,"Summer of Discontent"
20010509,unknown,"Way to Buddhahood"
20010509,unknown,"Families Mean Business"
20010509,unknown,"Straight Answers"
20010509,unknown,"Cong office-bearer gets conditional bail"
20010509,unknown,"Sports city on the anvil"
20010509,unknown,"Blair names June 7 for general polls"
20010509,unknown,"When Bryan Adams took mangoes to a B'lore soothsayer"
20010509,unknown,"This Cong MLC cares a damn for CM"
20010509,unknown,"Recurrent fish deaths force govt to wake up"
20010509,unknown,"What went wrong? BJP ponders"
20010509,unknown,"Travel agency employee murdered in B'lore"
20010509,unknown,"Sonia refuses to meet ministers; party workers"
20010509,unknown,"A masterplan to stop flooding"
20010509,unknown,"All for a song"
20010509,unknown,"Debate on Jaya becoming CM absurd: Advani"
20010509,unknown,"Unauthorised primary schools may be regularised"
20010509,unknown,"Electronic voting can check proxy votes"
20010509,unknown,"'Don't throw the baby out with the bathwater'"
20010509,unknown,"New device helps identify criminals"
20010509,unknown,"Some summer fun"
20010509,unknown,"A Suitable Gene"
20010509,entertainment.english.hollywood,"FINDING FORRESTER"
20010510,unknown,"65% turnout in Assembly polls; repoll ordered in 75 polling stations"
20010510,unknown,"Army plays wargames; but discounts N-attack"
20010510,unknown,"FDI in defence opens up Pandora's box"
20010510,unknown,"Pact to pave way for Quattrochi extradition"
20010510,unknown,"Fardeen Khan released on bail"
20010510,unknown,"Year-old population panel got just a logo"
20010510,unknown,"A Shameful Hunger"
20010510,unknown,"Defence Inc"
20010510,unknown,"Feared Beard"
20010510,unknown,"Irrational Exuberance"
20010510,unknown,"Spirituality's Vital Role in Counselling"
20010510,unknown,"Tea and Sympathy"
20010510,unknown,"Personal Experience"
20010510,unknown,"Reddy; Steady; Go"
20010510,unknown,"Straight Answers"
20010510,unknown,"Hi-tech hospital to come up by 2002"
20010510,unknown,"Govt action against bank politically motivated"
20010510,unknown,"Zuwarkar's residence; GSCB head office raided"
20010510,unknown,"294 cases of illegal constructions reported"
20010510,unknown,"Exit polls gives AIADMK thin edge"
20010510,unknown,"Jaya still doesn't trust EVMs"
20010510,unknown,"Krishna to take 'Silicon Valley' to US"
20010510,unknown,"Hundreds of schools fail to provide SSLC results"
20010510,unknown,"Dressing the stars of 'Agni Varsha'"
20010510,unknown,"Yogis; techie gurus and fun officers at work here"
20010510,unknown,"2 BCC school girls among SSLC exams toppers"
20010510,unknown,"Adoption: Giving children a second chance"
20010510,unknown,"You can adopt a baby and be a parent too"
20010510,unknown,"A brush with Bryan"
20010510,unknown,"Global tenders invited for NGEF privatisation"
20010510,unknown,"Reliance offshore seismic survey off Karnataka coast soon"
20010510,unknown,"Early diagnosis will help cure thyroid problem"
20010510,unknown,"It's time for wholesome cricket"
20010510,unknown,"Welder with a difference"
20010511,unknown,"65% turnout in Assembly polls; repoll ordered in 75 polling stations"
20010511,unknown,"Army plays wargames; but discounts N-attack"
20010511,unknown,"FDI in defence opens up Pandora's box"
20010511,unknown,"Pact to pave way for Quattrochi extradition"
20010511,unknown,"Fardeen Khan released on bail"
20010511,unknown,"Year-old population panel got just a logo"
20010511,unknown,"A Shameful Hunger"
20010511,unknown,"Defence Inc"
20010511,unknown,"Feared Beard"
20010511,unknown,"Irrational Exuberance"
20010511,unknown,"Spirituality's Vital Role in Counselling"
20010511,unknown,"Tea and Sympathy"
20010511,unknown,"Personal Experience"
20010511,unknown,"Reddy; Steady; Go"
20010511,unknown,"Hi-tech hospital to come up by 2002"
20010511,unknown,"Govt action against bank politically motivated"
20010511,unknown,"Zuwarkar's residence; GSCB head office raided"
20010511,unknown,"294 cases of illegal constructions reported"
20010511,unknown,"Exit polls gives AIADMK thin edge"
20010511,unknown,"Jaya still doesn't trust EVMs"
20010511,unknown,"Krishna to take 'Silicon Valley' to US"
20010511,unknown,"Hundreds of schools fail to provide SSLC results"
20010511,unknown,"Dressing the stars of 'Agni Varsha'"
20010511,unknown,"Yogis; techie gurus and fun officers at work here"
20010511,unknown,"2 BCC school girls among SSLC exams toppers"
20010511,unknown,"Adoption: Giving children a second chance"
20010511,unknown,"You can adopt a baby and be a parent too"
20010511,unknown,"A brush with Bryan"
20010511,unknown,"Global tenders invited for NGEF privatisation"
20010511,unknown,"Reliance offshore seismic survey off Karnataka coast soon"
20010511,unknown,"Early diagnosis will help cure thyroid problem"
20010511,unknown,"It's time for wholesome cricket"
20010511,unknown,"Welder with a difference"
20010511,unknown,"Tie-ups bring foreign medical expertise to B'lore"
20010511,unknown,"A house that can travel with you"
20010511,unknown,"Hair raising tales!"
20010511,unknown,"Swimming pool safety: Check before you dive"
20010511,unknown,"Delay in projects raises CM's hackles"
20010511,unknown,"Animal activists condone killing street dogs"
20010511,unknown,"Richmond flyover trial ends"
20010511,unknown,"MLA criticised for filing litigation"
20010511,unknown,"Judge to query CET Cell director"
20010511,unknown,"River Cauvery favourite theme for filmmakers"
20010512,unknown,"India backs Bush's defence plan"
20010512,unknown,"SC to CBI: What do you want to do with Hindujas?"
20010512,unknown,"Fardeen; anti-drugs lobby's new friend"
20010512,unknown,"Top Indian executive at Nortel steps down"
20010512,unknown,"End polygamy; Muslim woman pleads with SC"
20010512,unknown,"Life becomes miserable for Deendar preachers"
20010512,unknown,"Swaranjit Sen feigns ignorance of wife's activities"
20010512,unknown,"Auto drivers threaten to intensify stir"
20010512,unknown,"Neeru Meeru to be made a people's movement: CM"
20010512,unknown,"Don't keep shuttling to Hyderabad; DCs told"
20010512,unknown,"20 Cong leaders arrested during stir"
20010512,unknown,"Fiddling With FDI"
20010512,unknown,"The Balco Question"
20010512,unknown,"Honest Injun"
20010512,unknown,"Script for Success"
20010512,unknown,"Auroville; the City of Dawn"
20010512,unknown,"Life's Little Games"
20010512,unknown,"Mother Shakti"
20010512,unknown,"Karuna for Jaya"
20010512,unknown,"Straight Answers"
20010512,unknown,"Bomb scare in Lodhi Gardens"
20010512,unknown,"No factory record of cycle used in blast"
20010512,unknown,"Hindujas say CBI plea premature"
20010512,unknown,"Notice to Sushil's former counsel"
20010512,unknown,"HC grants bail to Olga's aide"
20010512,unknown,"Custody death charges against SI after 14 years"
20010512,unknown,"Demand for private protection on the rise"
20010512,unknown,"Tenant sues Shahi Imam's brother"
20010512,unknown,"Insurance firm challenges compensation ruling"
20010512,unknown,"Gang of specialised car thieves held"
20010512,unknown,"New panel will suggest ways to check female foeticide"
20010512,unknown,"Kant witnesses an unusual demonstration"
20010512,unknown,"Dentist's wife murdered"
20010512,unknown,"Mum's the word"
20010512,unknown,"The billionth baby turns 1"
20010512,unknown,"DU principals meet VC over suspension"
20010512,unknown,"DUSU starts website on admissions"
20010512,unknown,"Fiddling With FDI"
20010513,unknown,"Centre stalls CBI move on Ayodhya"
20010513,unknown,"SC allows two Hinduja brothers to go abroad"
20010513,unknown,"US has its very own Laloo"
20010513,unknown,"Sushma braves the bare breast threat at Cannes"
20010513,unknown,"Move over Shakespeare; this is an andolan"
20010513,unknown,"Karuna for Jaya"
20010513,unknown,"Straight Answers"
20010513,unknown,"Fiddling With FDI"
20010513,unknown,"The Balco Question"
20010513,unknown,"Honest Injun"
20010513,unknown,"Auroville; the City of Dawn"
20010513,unknown,"Life's Little Games"
20010513,unknown,"Mother Shakti"
20010513,unknown,"Will it be photo-finish this time?"
20010513,unknown,"SSLC results: the agony continues"
20010513,unknown,"Fellowship helps them fight alcoholism"
20010513,unknown,"The question now is who is whose Enemy No.1 ?"
20010513,unknown,"Backed by deputy mayor; resident flouts building rules"
20010513,unknown,"Hotel Ashok murder: Cops find suspects' photos"
20010513,unknown,"Get those muscles moving"
20010513,unknown,"Nightingale awards to 22 nurses"
20010513,unknown,"Coming clean"
20010513,unknown,"Drunkard drives daughter to suicide; kills himself"
20010513,unknown,"Bank hikes interest on deposits for senior citizens"
20010513,unknown,"Funds for rural uplift not used"
20010513,unknown,"Committees to supervise water supply in Belgaum"
20010513,unknown,"Poll win celebration leads to violence"
20010513,unknown,"Head comes first; helmets next!"
20010513,unknown,"Workshop for women artists today"
20010513,unknown,"World Billava Conference inaugurated in Udupi"
20010513,unknown,"BU Syndicate member demands inquiry"
20010513,unknown,"Rs 120 cr for water scheme in Belgaum: CEO"
20010513,unknown,"Encroachments threaten 900-year-old temple"
20010513,jugular-vein,"Foreign Arder"
20010513,jugular-vein,"Contemptibly yours"
